<?xml version="1.0" encoding="utf-8" ?>
<Project xmlns:xs="http://www.w3.org/2001/XMLSchema-instance" xs:schemaLocation="http://mappie.plik.se Project_schema.xsd">
  
  <Properties>
    <Name>Example project</Name>
    <Copyright>plik</Copyright>
    <Version>1.0.0</Version>
    <ZoneSizes>10;10</ZoneSizes>
    <TileSizes>32;32</TileSizes>
  </Properties>
  
  <Zones>
    <Zone>
      <Location>0;0</Location>
    </Zone>
    <Zone>
      <Location>1;0</Location>
      <Tiles>
        <DefaultTile>
          <Tileset>Field</Tileset>
          <Tile>00000000-0000-0000-0000-000000000000</Tile>
        </DefaultTile>
        <Tile>
          <Location>0;0</Location>
          <Tileset>Field</Tileset>
          <Tile>00000000-0000-0000-0000-000000000000</Tile>
        </Tile>
      </Tiles>
    </Zone>
  </Zones>

  <Tilesets>
    
    <Tileset>
      <Name>Field</Name>
      <Tiles>
        <Tile>
          <Id>00000000-0000-0000-0000-000000000000</Id>
          <Data><![CDATA[This is where tile data will be present]]></Data>
        </Tile>
      </Tiles>
    </Tileset>

    <Tileset>
      <Name>City</Name>
      <Tiles>
        <Tile>
          <Id>00000000-0000-0000-0000-000000000000</Id>
          <Data><![CDATA[This is where tile data will be present]]></Data>
        </Tile>
      </Tiles>
    </Tileset>
    
  </Tilesets>
  
</Project>